Name,Link,Image_link,Price,Number_of_ratings,Discount,Fastes_delivery_date,Bought_last_month,About_iten,Fastest_delivery_date,About_item
"Apple Watch Series 9 [GPS 41mm] Smartwatch with Silver Aluminum Case with Storm Blue Sport Band S/M. Fitness Tracker, Blood Oxygen & ECG Apps, Always-On Retina Display, Water Resistant",https://www.amazon.in/Apple-Smartwatch-Aluminum-Fitness-Resistant/dp/B0CHY1PQJ8/ref=sr_1_3?dib=eyJ2IjoiMSJ9.zB1zZWt9eKZ_YZoXPNKYHUVOqiXjknSkISfGz4ezymI1Bba_nO-G_ZJm9O1KBxIOt6kvI9pQWs5UfCo4BEFjJP8_aM5o5m4ljyHPXG94aBpsCWbqJ4A61ec1fL6r0oXr9gPjoRyA-v7UeSljzAMUCE2T39xlgTmgZhUwKQkv-rkhQS-mdWq2tLJnjGBHpzKTHbc4NZhij135tcYEYTmZF0wrt_LWCrU9knd8QhxZWh0.HXHP-KV2DLZI2G-EFEOAfcGJWd6nlazsuS6RKlvmh4s&dib_tag=se&keywords=apple+watch&qid=1710041084&sr=8-3,,,191 ratings,"₹41,900",,,,"Tuesday, 12 March","WHY APPLE WATCH SERIES 9 — Your essential companion for a healthy life is now even more powerful. The S9 chip enables a super-bright display and a magical new way to quickly and easily interact with your Apple Watch without touching the screen. Advanced health, safety and activity features provide powerful insights and help when you need it. And redesigned apps in watchOS give you more information at a glance.CARBON NEUTRAL — An aluminium Apple Watch Series 9 paired with the latest Sport Loop is carbon neutral.ADVANCED HEALTH FEATURES—Keep an eye on your blood oxygen. Take an ECG anytime. Get notifications if you have an irregular heart rhythm. See how much time you spent in REM, Core, or Deep sleep with sleep stages. Temperature sensing provides insights into overall well-being and cycle tracking. And take note of your state of mind to help build emotional awareness and resilience.A POWERFUL FITNESS PARTNER—The Workout app gives you a range of ways to train plus advanced metrics for more insights about your workout performance.INNOVATIVE SAFETY FEATURES—Fall Detection and Crash Detection can connect you with emergency services in the event of a hard fall or a severe car crash. And Emergency SOS lets you call for help with the press of a button."
"Apple Watch SE (2nd Gen) [GPS 40 mm] Smart Watch w/Midnight Aluminium Case & Midnight Sport Band. Fitness & Sleep Tracker, Crash Detection, Heart Rate Monitor, Retina Display, Water Resistant",https://www.amazon.in/Apple-Watch-Midnight-Aluminium-Sport/dp/B0BDKJFFX9/ref=sr_1_4?dib=eyJ2IjoiMSJ9.zB1zZWt9eKZ_YZoXPNKYHUVOqiXjknSkISfGz4ezymI1Bba_nO-G_ZJm9O1KBxIOt6kvI9pQWs5UfCo4BEFjJP8_aM5o5m4ljyHPXG94aBpsCWbqJ4A61ec1fL6r0oXr9gPjoRyA-v7UeSljzAMUCE2T39xlgTmgZhUwKQkv-rkhQS-mdWq2tLJnjGBHpzKTHbc4NZhij135tcYEYTmZF0wrt_LWCrU9knd8QhxZWh0.HXHP-KV2DLZI2G-EFEOAfcGJWd6nlazsuS6RKlvmh4s&dib_tag=se&keywords=apple+watch&qid=1710041084&sr=8-4,,"28,900","2,226 ratings",-3%,,200+ bought in past month,,"Tuesday, 12 March","WHY APPLE WATCH SE — All the essentials to help you monitor your fitness, keep connected, track your health and stay safe. Now up to 20% faster, with features like Crash Detection and enhanced workout metrics, it’s a better value than ever.EASILY CUSTOMISABLE — Available in a range of sizes and colours, with dozens of straps to choose from and watch faces with complications tailored to whatever you’re into.HEALTH AND SAFETY FEATURES — Get help when you need it with Crash Detection, Fall Detection and Emergency SOS. Get deep insights into your health, including notifications if you have an irregular rhythm or an unusually high or low heart rate.SIMPLY COMPATIBLE — It works seamlessly with your Apple devices and services. Unlock your Mac automatically. Find your devices with a tap. Apple Watch requires an iPhone 8 or later with the latest iOS version.SWIMPROOF AND STYLISH — Water resistant to 50 metres. Three finishes. And a redesigned, colour-matched back case made with a new production process that reduces its carbon emissions by over 80%."
"Apple Watch Series 8 [GPS 45 mm] Smart Watch w/Midnight Aluminium Case with Midnight Sport Band. Fitness Tracker, Blood Oxygen & ECG Apps, Always-On Retina Display, Water Resistant",https://www.amazon.in/Apple-Midnight-Aluminium-Fitness-Resistant/dp/B0BDKSLQ1X/ref=sr_1_5?dib=eyJ2IjoiMSJ9.zB1zZWt9eKZ_YZoXPNKYHUVOqiXjknSkISfGz4ezymI1Bba_nO-G_ZJm9O1KBxIOt6kvI9pQWs5UfCo4BEFjJP8_aM5o5m4ljyHPXG94aBpsCWbqJ4A61ec1fL6r0oXr9gPjoRyA-v7UeSljzAMUCE2T39xlgTmgZhUwKQkv-rkhQS-mdWq2tLJnjGBHpzKTHbc4NZhij135tcYEYTmZF0wrt_LWCrU9knd8QhxZWh0.HXHP-KV2DLZI2G-EFEOAfcGJWd6nlazsuS6RKlvmh4s&dib_tag=se&keywords=apple+watch&qid=1710041084&sr=8-5,,"38,999","1,699 ratings",-20%,,,,"Tuesday, 12 March","WHY APPLE WATCH SERIES 8 — Your essential companion for a healthy life is now even more powerful. Advanced sensors provide insights to help you better understand your health. New safety features can get you help when you need it. The bright, Always-On Retina display is easy to read, even when your wrist is down.EASILY CUSTOMISABLE — Available in a range of sizes and materials, with dozens of straps to choose from and watch faces with complications tailored to whatever you’re into.INNOVATIVE SAFETY FEATURES — Crash Detection and Fall Detection can automatically connect you with emergency services in the event of a severe car crash or a hard fall. And Emergency SOS provides urgent assistance with the press of a button.ADVANCED HEALTH FEATURES — Temperature sensing is a breakthrough feature that provides deep insights into women’s health. Keep an eye on your blood oxygen. Take an ECG anytime. Get notifications if you have an irregular rhythm. And see how much time you spent in REM, Core or Deep sleep with sleep stages.SIMPLY COMPATIBLE — It works seamlessly with your Apple devices and services. Unlock your Mac automatically. Find your devices with a tap. Apple Watch requires an iPhone 8 or later with the latest iOS version."
"Apple Watch SE (2nd Gen, 2023) [GPS 44mm] Smartwatch with Starlight Aluminum Case with Starlight Sport Loop One Size. Fitness & Sleep Tracker, Crash Detection, Heart Rate Monitor, Retina Display",https://www.amazon.in/Apple-Smartwatch-Starlight-Aluminum-Detection/dp/B0CHY4D5LV/ref=sr_1_6?dib=eyJ2IjoiMSJ9.zB1zZWt9eKZ_YZoXPNKYHUVOqiXjknSkISfGz4ezymI1Bba_nO-G_ZJm9O1KBxIOt6kvI9pQWs5UfCo4BEFjJP8_aM5o5m4ljyHPXG94aBpsCWbqJ4A61ec1fL6r0oXr9gPjoRyA-v7UeSljzAMUCE2T39xlgTmgZhUwKQkv-rkhQS-mdWq2tLJnjGBHpzKTHbc4NZhij135tcYEYTmZF0wrt_LWCrU9knd8QhxZWh0.HXHP-KV2DLZI2G-EFEOAfcGJWd6nlazsuS6RKlvmh4s&dib_tag=se&keywords=apple+watch&qid=1710041084&sr=8-6,,"30,699",23 ratings,-41%,,,,"Tuesday, 12 March","CARBON NEUTRAL — Apple Watch SE (2nd generation) paired with the latest Sport Loop is carbon neutral.WHY APPLE WATCH SE — All the essentials to help you be motivated and active, keep connected, track your health, and stay safe. The Smart Stack and redesigned apps in watchOS 10 help you see more information at a glance. With features like Crash Detection and enhanced workout metrics, Apple Watch SE is a better value than ever.HEALTH AND SAFETY FEATURES—Get help when you need it with Fall Detection, Crash Detection, and Emergency SOS. Get deep insights into your health, including notifications if you have an irregular heart rhythm or an unusually high or low heart rate.SIMPLY COMPATIBLE—It works seamlessly with your Apple devices and services. Unlock your Mac automatically. Find your devices easily. Apple Watch SE requires iPhone XS or later with iOS 17 or later.SWIMPROOF AND STYLISH—Water resistance rating of 50 meters. Three finishes. And a color-matched back case made with a production process that reduces its carbon emissions."
"Apple Watch Ultra 2 [GPS + Cellular 49mm] Smartwatch with Rugged Titanium Case & Blue Ocean Band One Size. Fitness Tracker, Precision GPS, Action Button, Extra-Long Battery Life, Bright Retina Display",https://www.amazon.in/Apple-Cellular-Smartwatch-Precision-Extra-Long/dp/B0CHY1ZNT4/ref=sr_1_7?dib=eyJ2IjoiMSJ9.zB1zZWt9eKZ_YZoXPNKYHUVOqiXjknSkISfGz4ezymI1Bba_nO-G_ZJm9O1KBxIOt6kvI9pQWs5UfCo4BEFjJP8_aM5o5m4ljyHPXG94aBpsCWbqJ4A61ec1fL6r0oXr9gPjoRyA-v7UeSljzAMUCE2T39xlgTmgZhUwKQkv-rkhQS-mdWq2tLJnjGBHpzKTHbc4NZhij135tcYEYTmZF0wrt_LWCrU9knd8QhxZWh0.HXHP-KV2DLZI2G-EFEOAfcGJWd6nlazsuS6RKlvmh4s&dib_tag=se&keywords=apple+watch&qid=1710041084&sr=8-7,,"84,199",50 ratings,-6%,,,,"Tuesday, 12 March","WHY APPLE WATCH ULTRA 2 — Rugged, capable and built to meet the demands of endurance athletes, outdoor adventurers and water sports enthusiasts — with a specialised strap for each. The S9 SiP enables a super-bright display and a magical new way to quickly and easily interact with your Apple Watch without touching the display. Up to 36 hours of battery life and 72 hours in Low Power Mode.CARBON NEUTRAL — Apple Watch Ultra 2 paired with the latest Alpine Loop or Trail Loop is carbon neutral.EXTREMELY RUGGED, INCREDIBLY CAPABLE—49mm corrosion-resistant titanium case. Large Digital Crown and customizable Action button for instant control over a variety of functions. 100m water resistance.BIGGEST, BRIGHTEST DISPLAY YET—Apple’s brightest Always-On Retina display is easy to see, even in harsh sunlight. More room for adding complications to customize your watch face and enough space to view six metrics at once.THE FREEDOM OF CELLULAR—Cellular is built in. You can call and text without your iPhone. Stream your favorite music and podcasts. Get directions with Maps.FOR ATHLETES — Advanced metrics and views in the Workout app, including Heart Rate Zones, custom workouts, and new cycling workout views. Precision dual-frequency GPS provides incredible accuracy for calculating distance, pace, and route maps. Trail Loop is a light, thin, and flexible band, designed especially for all workout types.FOR OUTDOOR ADVENTURERS — The Compass app delivers helpful views and details like elevation, incline, longitude, and latitude. See the last place where you had cellular reception. Mark your location with Compass Waypoints. Backtrack uses GPS to map where you’ve been so you can retrace your steps. Alpine Loop is an extremely rugged and secure band to meet the needs of all outdoor adventurers."
