reviewer_name,review_title,review
Puneet,Good for reading books with perfect brightness and feel,I really love my Kindle Oasis. I am enjoying reading the books the brightness the colour everything is perfect. It feels like I am reading a real book the colour and texture in the pages make me feel that way. The only thing I I want you to be added in future versions is that it does not have voice typing option in the keyboard. Aur even if I could add keyboard like in Android by installing third-party keyboard that would have been great because they allow to voice type. As now I'm really using voice type in most of the time on phones and even in my laptop. One other thing I want is it's such a costly and fine piece of technology though still in does not have 5ghz network support. downloading a single book on 2ghz does not take much time. But downloading multiple books or synchronisation of multiple books at time then 5ghz would have lot faster and convenient. One more thing to add I am ok with hand holding it by one hand but if there was some option for stand in the cover provided by Amazon or some maybe mechanism which made it support on desk easily for hold easily then I would have given 5 stars
Anji.A,Great product from Amazon,"This is my 5th kindle, I am big fan of Kindle, love' it"
,"Best there is, but","I bought it on a Prime Day offer for Rs.17,999. 8gb wifi only variant. There is no use buying a 32gb model since Audible support is not available in India. 8gb is enough to hold thousands of books.
This variant of the kindle is the most premium offered by Amazon, the body looks and feels premium. It is fully made of metal. The design is ergonomic and stacked on one side making it easy to hold.
the screen is of 7-inch which feels like a real book and I like the shape of the screen its more closer to a book. the screen has a very good pixel density so it is very sharp even if you use a very low font size.
the Oasis comes with warm light which does make quite a difference while reading at night. the screen can get very bright has 25 LEDs compared to Paperwhites 5.
The battery life is quite good and it easily lasts a week under a long session of reading. I have come across many reviews which have said the battery life lesser than the Paperwhite but I didn't find any problems with that.
The page turn buttons are customizable and it's a very convenient way to turn the pages. It can be used by either hand, the page automatically turns around.
It's a great choice BUT it depends on you how much it matters to you because apart from the big screen, warm lighting, page turn buttons the rest are the same features with the Paperwhite which is almost Rs.8000 cheaper than Oasis. The screen on both the Oasis and Paperwhite are of the same resolution, both are waterproof. You won't go wrong with either of the two devices."
Shrabandip Mahanta,"Great device for reading, no doubt, but Amazon packing of this expensive device is HORRIBLE!!","Device is definitely great for reading books, I've been reading alot after getting Kindle and I bought because of 7 inch screen and buttons, I don't use warm light very much, battery is decent isn't great,I read for 2 - 3 hrs a day so I charge once a week, with power adapter you can charge device in less than an hour, so that's very helpful, I had some issue with first device so Amazon replaced it without much hassle, my biggest issue is with how Amazon packed this expensive fragile device, it was careless to be honest, I could see a dent on the package, thankfully device was fine, but I request Amazon to pack things more carefully with more bubble wrap I guess, it had no bubble wrap at all, I bought Hard cover of a book recently am just scared now how Amazon will pack the book as it's 10 anniversary edition of Mistborn trilogy, packing gotten worse lately

As for the device, device is great for reading 8 gb is more than enough and easy to hold, I bought with black fabric cover, this device definitely needs the magnetic cover to protect as we don't have much choice, fabric cover is of good Material I have no complaints with cover"
,Ovarall product is good however the price is little bit higher,"The UI is very slow ( though it should not be bothering you because you're only reading in it , not playing a game or something lol) . I shifted from Kindle 7th generation to this oiasis 10th generation, it looks like the battery draining rate is faster in oiasis than kindle , in 1 full charge I can read upto 2 and half or 3 days. However in. Kindle I used to charge once in a week . The mat finished design is so primium and it is easy to hold. The page turning buttons and the auto adjustable brightness are really helpful. Though there is a dark mode however I don't like it (personal choice) .
However overall the price is slightly high ... I have the 32 gb wifi varient it took 24999 INR , which should be 18000-20000 INR"
Krishna,Definitely worth it,I got my kindle 2 months ago I was doubting at the beginning if the upgrade was worth it but I can tell now it is . This kindle accepts PDF documents also so I don’t have to change the format to be able to read it and only because if that I’m extremely happy. The books with graphics are also with a great quality to read ñ. I recommend the upgrade.
,Device is for real readers! OneAssist is worst addon.,"Don't listen to negative reviews. The device is awesome. This is not for people who haven't read atleast a few books. You need to be a reader first then only you can enjoy the device. Its amazing to hold, lighter in weight than even the small mobile phone. Big screen than mobile phone - overall wonderful experience to read just like a book. We can adjust font, carry more books, kindle unlimited for free books, dictionary, searching within books, notes - so many features we wont get in a physical book. Lighter than mobile phones, no eye-straining, comfortable hold even when you are lying down, distraction free are the advantages over mobile phones and tablets.

That said, I purchased OneAssist plan for 1699. When trying to activate, OneAssist people told me that the plan is not for this model of Kindle. However in Amazon they sell with explicitly mentioning One Assist protection plan for 1699 is for this model. I lost 1699 in between Amazon and OneAssist. So don't purchase OneAssist plan at all - its total bakwaas."
AAYMADEEP R PRADHAN,good start,"Its been more than 2 weeks since I started using Kindle Oasis. This is my first kindle purchase and so I cant compare the other models to Oasis.
Usability: It is comfortable and easy to use.
Product: New Product.
Features:
Pros:
1.Almost all the features mentioned in the Tech Specs works well.
2. Settings - lighting, brightness works well.
3. Page turn button is my all time favourite.
4. Works well with Kindle format books

Cons:
1. The PDF format books are not easy to read.
2. The kindle font settings doesnt apply to PDF."
,Rekindle your reading experience!,"Awesome device for avid readers. It feels overpriced but it can hold 100s of books. For 8 gb device you get around 6gb space. Also kindle format books are little cheaper as compared to paper back so in the long run you save money on books. You will like it if you are fan of bigger screen. But it won't fit in your pocket as the paperwhite does. Also it has few useful enhancements over the previous devices.

Auto screen rotation - is helpful when you change hands to hold the device
Auto brightness - good feature like smart phone but consumes more battery
Physical turn buttons - you can turn off touch and use the physical buttons to turn pages. It's really helpful
Warm led lights - good for night reading

I have experienced battery drain issues initially but turning on the aeroplane mode as well as turning off the auto brightness feature saves the battery. Also I had to hard reboot the device once by long pressing the power button. Now the device lasts for about one and half to two weeks with about 40 minutes of reading every day. Also in week ends I read more about 1.5 to 2 hours. I am liking it and am not regretting my purchase."
Kindle Customer,Great Kindle but the battery life is not as promised,"The Kindle is very cool and the champagne colour is good too. its very easy to use and the features are all good. I like this seize of the kindle and its easy to hold and read.
the touch screen is good so far.
what i dont like is the battery life. everyone claims that Kindle battery lasts for weeks but mine is max 3 days. Yes, i read for hrs non stop but still the battery life should have been better.
therefore 4 stars"
Sindhu,better experience than paperwhite,"I've had kindle 2 to kindle paperwhite models and oasis 10th gen is by far the best reading experience I've had in a long time! I am an audiobook kind of person. I have over 500 hours of listening on Audible and am very pleased that this kindle supports audiobooks!

BUT the only downside the kindle doesn't have a sleep timer for audiobooks so good luck putting that audiobook and snoozing. Also you cannot listen to podcasts you have added on Audible app on the kindle."
Prasad,Great Product who reads a lot,"I was using the old kindle which I could not use in the dark, but with I can even read without turning on the lights. Overall very happy with product."
Hari,Fantastic device for avid readers,"I upgraded to this from a basic Kindle, and I'm absolutely blown away!

Before I begin, though, I must say that the Oasis is an indulgence, and the Paperwhite and the Kindle basic do the job equally well. But if you read extensively, and if reading is your primary leisure time activity, it's definitely worth looking into.

Here's what I love about the Oasis:

1. Bigger Screen: This makes more difference than you would think. I find it sized like a small paperback, and it makes the reading experience pleasant. There is also the advantage of more words per page, and lesser turns.

2) Ergonomics: There is a side panel with page turn buttons, and you can just rest your thumb comfortably between the buttons, while gripping the slight bulge at the back with your palm. If you want to change your hand, you flip the device device upside down, and the text also gets flipped. This makes one-handed reading very comfortable.

3) Screen and lighting: The screen is super sharp and very easy on the eyes. I generally do not use the lighting at daytime, and find it very comfortable even in sunlight. The device's light comes in handy in low lighting environments, and with the new warmth feature, you can now customize the tint of the lighting as well. I find the yellowish tint to be more pleasant for night reading."
Pavi,Kindle Oasis: Best eReader that’s There,"My first Kindle device and I wanted to have something that would last for next few years without getting outdated. So Oasis (32 GB, without 3 or 4G) fits the Bill, a bit costlier though. I understand the design specs, so would have loved it to have the colour display too. May not be always needed, but colour would have given a new life to comics and illustrations; not sure how that would have impacted the technical specs of battery life, screen design but I am sure it was manageable (Pebble managed a watch screen akin to this in colour way back in 2015 with 7 days battery life). Other feature being IP68 compliant is absolutely necessary with any electronic device, we are well into 21st century. Battery life is great, auto screen brightness and warmth adjustments are good, even bit of browsing on its browser is good. I may be expecting too much, but if Amazon would have incorporated Bluetooth connectivity and functionality for Audible (I am sure, Amazon would be having the model ready and is saving it for future release), we would have had the choice to decide."
Dinesh Kulkarni,Kindle Oasis 10th Generation is my new buddy!!,"Kindle Oasis 10th Generation with Wifi and 32GB is a fantastic reading buddy. Amazon service is super lightening fast. the package was extremely neat and well protected. In fact I was indicated delivery by 22nd March but was surprisingly delivered by 15th March,2020. Product cost me Rs.24999 which I believe totally value for money. Its beautiful champagne gold coloured. I have yet to explore all the features though I could quickly got familiarised with few important ones. It has smooth navigation and access to my goodreads library. The most attractive feature that I found was the highlight of the book wherein you get to know a lot about the book, you can highlight important aspects of the book as you read, vocabulary builder is just amazing, power usage is good though its too early for me to comment on it. I would certainly provide another review after a month or so to provide more elaborate observations. The kindle unit is very premium looking, easy to handle, feature on warmth is good and easy on eyes. Overall, would recommend to anyone who want to go on reading spree without accumulating hard copy books and also want to get lot more from reading and who is willing to part with some extra dime for the permium version of Kindle.. Kindle Oasis 10th Generation with 7"" premium screen!!..."
Sarah T,Battery issues,Everything seems good about the kindle oasis but when it comes to battery life it doesn’t even last for a week and it refused to charge to a 100% always hovering over the 98% mark . I tried all the suggestions from the online forum where many had the same issue to no avail . I read for an average of about 3 hours a day and I had to charge it every few days . Must say the paper white had a much better battery .. where I would recharge my kindle after two weeks given the time spent with my kindle was the same After speaking to customer service and reading several reviews online i purchased a new oasis and have requested for a return and refund of this kindle . Keeping my finger crossed that this battery is better and does justice to the exorbitant cost of the oasis ! I bought the oasis as a treat to myself for all the reading I do but was very disappointed with the battery .
V. Sridhar,A great reading device - the best Kindle,"The Kindle Oasis is the best Kindle, although I think it is over-priced. It has some improvements, such as the feature that allows the device to reorient the text if it is flipped upside down. More storage space is another advantage. Despite the proliferation of Kindles it is strange that Amazon still does not have a dedicated support system for users. I had to deal with a glitch in Amazon's systems that created problems while using the Send-to-Kindle feature. Strangely, even after a week Amazon's staff were unable to offer me a solution from the pesky requirement of having to ""verify"" every single document that I was trying to. send to the Oasis. After multiple attempts, over several days, I found the ""solution"" by deregistering all my other devices. Surely, users expect better from Amazon. In fact, it is difficult to even engage with Amazon support on this issue. Amazon should address this issue on a priority basis."
Rohan,Read the complete honest review.,"So here, finally I bought the Kindle Oasis after thinking which one to buy out of all the Kindle.
1) Product quality:- The quality of the product is beautiful. It does feel like paper as they claim. But that's just about the physical quality. 9/10
2) Touch screen performance:- To be honest, it's not that great. The touch is delayed by seconds and there's even black and white flicker when we do any action or turn the screen around. It does not feel worth it for paying Rs. 21,999. 3/10
3) Overall product performance:- Battery is quite good. Last for weeks. Just not that happy with the touch screen. It does not feel worth paying the amount.
You can adjust reading on very good tablet in the same amount rather than a kindle.
Thus, think twice, experience the kindle if possible without buying it. Or if buying, go for a lower version of Kindle and not this one."
Sumit Sengupta,There is a line on the screen,"Defective product delivered.
There is a line on the screen. Not able to return also"
